{
  "schema": "volante-style/1",
  "created_at": "2026-10-17T18:00:00Z",
  "source": {
    "sessions": 1,
    "swings": 8,
    "minutes": 0.342,
    "pod_fw": "unknown",
    "tool": "oso-rec 0.1.0"
  },
  "speed": {
    "p50_kmh": 33.3,
    "p90_kmh": 60.3,
    "cv": 0.539,
    "clipped_frac": 0.125
  },
  "tempo": {
    "median_gap_s": 2.0,
    "p25_gap_s": 1.81,
    "p75_gap_s": 2.34
  },
  "stroke_mix": null,
  "side_mix": null,
  "notes": "speeds are estimates (gyro x 0.53 m) and lower bounds when clipped"
}
